[
  {
    "schemaVersion": "https://movielabs.com/omc/json/schema/v2.6",
    "entityType": "Location",
    "identifier": [
      {
        "identifierScope": "labkoat",
        "identifierValue": "loc/CJXwmiWy3cXV802h-5fWI"
      }
    ],
    "address": {
      "street": "405 Av. Ogilvy B",
      "locality": "Montr√©al",
      "region": "Quebec",
      "postalCode": "QC H3N 1M3",
      "country": "CA"
    },
    "coordinates": {
      "latitude": 45.53072,
      "longitude": -73.62522
    }
  },
  {
    "schemaVersion": "https://movielabs.com/omc/json/schema/v2.6",
    "entityType": "Location",
    "identifier": [
      {
        "identifierScope": "labkoat",
        "identifierValue": "loc/CJXwmiWy3cXV802h-5fWI"
      }
    ],
    "address": {
      "street": null,
      "locality": null,
      "region": null,
      "postalCode": null,
      "country": null
    },
    "coordinates": {
      "latitude": null,
      "longitude": null
    }
  },
  {
    "schemaVersion": "https://movielabs.com/omc/json/schema/v2.6",
    "entityType": "Location",
    "identifier": [
      {
        "identifierScope": "labkoat",
        "identifierValue": "loc/CJXwmiWy3cXV802h-5fWI"
      }
    ],
    "address": null,
    "coordinates": null
  }
]
